{
  "$schema": "../schema/site.json",
  "title": "paula barjau",
  "url": "https://paulabarjau.studio",
  "ui": {
    "menu": {
      "ca": "menú",
      "es": "menú",
      "en": "menu"
    },
    "seeMore": {
      "ca": "veure més",
      "es": "ver más",
      "en": "see more"
    },
    "back": {
      "ca": "tornar",
      "es": "volver",
      "en": "back"
    }
  },
  "categories": {
    "fashion": {
      "name": {
        "ca": "moda",
        "es": "moda",
        "en": "fashion"
      },
      "color": "#C15896",
      "bg": "#C15896"
    },
    "commercial": {
      "name": {
        "ca": "comercial",
        "es": "comercial",
        "en": "commercial"
      },
      "color": "#FFBE7D",
      "bg": "#FFDFBE"
    },
    "videoclip": {
      "name": {
        "ca": "videoclip",
        "es": "videoclip",
        "en": "videoclip"
      },
      "color": "#B28DFF",
      "bg": "#D9C6FF"
    },
    "editorial": {
      "name": {
        "ca": "editorial",
        "es": "editorial",
        "en": "editorial"
      },
      "color": "#7DB3AF",
      "bg": "#D2E4E3"
    }
  },
  "lists": {
    "home": {
      "projects": [
        "aitanaBonmati",
        "torito",
        "siMurieraManana",
        "stoicMagazine",
        "alMagazine",
        "ainara"
      ]
    }
  }
}
